{
  "format": 2,
  "code": "smoke-apartment-102-2",
  "version": 3,
  "replaces": [
    "f1afb9da-3658-5910-a2bb-0178b90f15a0"
  ],
  "title": "Задымление в квартире",
  "service_id": "102",
  "level": 2,
  "weight": 1,
  "incident_type_code": "1050102",
  "complications": [],
  "teacher_comment": "Тренировка без преподавателя: задымление в квартире 115, Бескудниковский бульвар, 24. Наряд повторяет адрес с ошибкой (переулок вместо бульвара) — диспетчер поправляет; на месте спрашивает этаж — он в карточке. Хозяин открыл сам, дым от подгоревшей еды: работ не было, карточку закрывает «Отказ от выполнения работ» с причиной.",
  "outcome": {
    "people": "Наряд поднялся к квартире 115 на девятом этаже. Хозяин открыл дверь сам: дым был от подгоревшей еды, правонарушения нет. Работ не было — наряд доложил об этом, и карточку закрыли отказом от выполнения работ с причиной.",
    "late": "Карточку приняли позже норматива. Заранее не известно, что дым — от подгоревшей еды: пожилой мужчина, который не открывает дверь, мог лежать без сознания в задымлённой квартире.",
    "status": "Работ на месте не было: такую карточку закрывают «Отказом от выполнения работ» с причиной, а не статусом «Работы завершены». Ход статусов в вашей карточке отличается от доклада наряда."
  },
  "card": {
    "caller_name": "Громова Светлана Игоревна",
    "phone_aon": "+79000000711",
    "phone_provided": "",
    "phone_scene": "",
    "address": {
      "city": "Москва",
      "okrug": "САО",
      "district": "Бескудниковский",
      "street": "Бескудниковский бульвар",
      "house": "24",
      "building": "",
      "apartment": "115"
    },
    "description": "Из-под двери квартиры 115 на девятом этаже идёт дым, открытого огня не видно. В квартире живёт пожилой мужчина, на звонки в дверь не открывает. Дом газифицирован.",
    "tags": [],
    "victims": true,
    "ambulance_refused": false,
    "blocked_people": false,
    "emergency": false,
    "incident_class": "задымление: квартира",
    "service_ids": [
      "101",
      "102",
      "103",
      "104"
    ],
    "number": "70005112",
    "incident_type_code": "1050102"
  },
  "reference": {
    "expected_flow": [
      "received",
      "accepted",
      "responding",
      "arrived",
      "refused"
    ],
    "required_fields": [
      "service_number",
      "comment"
    ],
    "expected_service_ids": [
      "102"
    ],
    "expected_address": {
      "city": "Москва",
      "okrug": "САО",
      "district": "Бескудниковский",
      "street": "Бескудниковский бульвар",
      "house": "24",
      "building": "",
      "apartment": "115"
    },
    "expected_call": {
      "required": false,
      "service_id": "102",
      "phone_ext": "102",
      "before_s": 180
    },
    "expected_comment": "Из-под двери квартиры 115 на девятом этаже идёт дым, открытого огня не видно. В квартире живёт пожилой мужчина, на звонки в дверь не открывает. Дом газифицирован. Хозяин открыл дверь сам, дым от подгоревшей еды, правонарушения нет, работы не проводили."
  },
  "brigades": [
    {
      "key": "b1",
      "ordinal": 0
    }
  ],
  "plan": [
    {
      "key": "departure",
      "brigade": "b1",
      "line": {
        "text": "Вызов принят, наряд направлен.",
        "audio": "bank-v2/102/102.responding.fight.1.ogg"
      },
      "after_s": 3,
      "requires_state": "accepted",
      "justifies_state": "responding"
    },
    {
      "key": "arrival",
      "brigade": "b1",
      "line": {
        "text": "Наряд на месте, поднимаемся к квартире.",
        "audio": "bank-v2/102/102.arrived.smoke.8.ogg"
      },
      "after_s": 6,
      "requires_state": "responding",
      "justifies_state": "arrived"
    },
    {
      "key": "outcome",
      "brigade": "b1",
      "line": {
        "text": "Хозяин открыл дверь сам, дым от подгоревшей еды, правонарушения нет, работы не проводили.",
        "audio": "bank-v2/102/102.refused.smoke.3.ogg"
      },
      "after_s": 6,
      "requires_state": "arrived",
      "justifies_state": "refused"
    }
  ],
  "events": [
    {
      "key": "readback",
      "kind": "readback_error",
      "trigger": {
        "on": "message",
        "after_s": 1,
        "report": "departure"
      },
      "line": {
        "text": "Принял: Бескудниковский переулок, двадцать четыре. Выезжаем!",
        "audio": "bank-v4/102/102.readback_trap.2e688cf2.ogg"
      },
      "expect": [
        {
          "action": "correct_readback",
          "option_key": "fix",
          "within_s": 30
        }
      ],
      "reply_options": [
        {
          "key": "fix",
          "label": "Поправка по адресу: Бескудниковский бульвар, 24"
        },
        {
          "key": "ok",
          "label": "Понял"
        }
      ],
      "branches": {
        "met": {
          "line": {
            "text": "Понял, понял. Перестраиваемся, это рядом.",
            "audio": "bank-v1/102/102.readback_fixed.any.3.ogg"
          },
          "effects": []
        },
        "wrong": {
          "line": null,
          "effects": [
            {
              "replace": "arrival",
              "with": {
                "text": "Диспетчер, по тому адресу нас никто не ждал. Сверились с карточкой, переехали, на месте, время потеряли.",
                "audio": "bank-v4/102/102.wrong_place.moved2.ogg"
              }
            },
            {
              "delay": "arrival",
              "by_s": 45
            }
          ]
        },
        "missed": {
          "line": null,
          "effects": [
            {
              "replace": "arrival",
              "with": {
                "text": "Диспетчер, по тому адресу никто не вызывал. Сверились с карточкой, переехали, теперь на месте. Потеряли время.",
                "audio": "bank-v4/102/102.wrong_place.moved.ogg"
              }
            },
            {
              "delay": "arrival",
              "by_s": 45
            }
          ]
        }
      },
      "review": {
        "label": "Наряд повторил адрес с ошибкой",
        "critical": true
      }
    },
    {
      "key": "floor",
      "kind": "clarify",
      "trigger": {
        "on": "message",
        "after_s": 2,
        "report": "arrival"
      },
      "line": {
        "text": "Диспетчер, на каком этаже квартира?",
        "audio": "bank-v1/102/102.clarify.any.1.ogg"
      },
      "expect": [
        {
          "action": "reply",
          "option_key": "floor_9",
          "within_s": 30
        }
      ],
      "reply_options": [
        {
          "key": "floor_9",
          "label": "Девятый этаж"
        },
        {
          "key": "floor_1",
          "label": "Первый этаж, квартира у входа"
        },
        {
          "key": "unknown",
          "label": "Этаж не знаю — спросите соседей"
        }
      ],
      "branches": {
        "met": {
          "line": {
            "text": "Понял, спасибо, дальше сами.",
            "audio": "bank-v1/102/102.clarify_ok.any.4.ogg"
          },
          "effects": []
        },
        "wrong": {
          "line": {
            "text": "Ясно. Пойдём по квартирам, поспрашиваем.",
            "audio": "bank-v1/102/102.clarify_unknown.any.2.ogg"
          },
          "effects": [
            {
              "delay": "outcome",
              "by_s": 25
            }
          ]
        },
        "late": {
          "line": {
            "text": "Уже нашли сами.",
            "audio": "bank-v1/102/102.clarify_late.any.1.ogg"
          },
          "effects": []
        },
        "missed": {
          "line": null,
          "effects": [
            {
              "delay": "outcome",
              "by_s": 25
            }
          ]
        }
      },
      "review": {
        "label": "Наряд спросил этаж — он был в описании карточки",
        "critical": false
      }
    }
  ],
  "traps": [
    "readback"
  ]
}
